Authors,Year,Title,Otherbibinfo,DOIorURI,WhatReviewed,Type,Discipline,ExDef,ImDef,OpenIdentities,OpenReports,OpenInteraction,OpenParticipation,OpeninTime,OpenPlatforms
"Konkiel, Stacy",2014,Impact Challenge Day 19: Establish Your Expertise with Open Peer Review,"Impactstory Blog, November 21, 2014",http://blog.impactstory.org/impact-challenge-open-peer-review/,Journal articles,Blog post,Interdisciplinary,"Shades of Open Peer Review
 In recent years, scientists have increasingly called for an Open alternative to traditional peer review. This has manifested in journals adopting Open Peer Review (OPR), researchers taking to their blogs to review already-published work, and the proliferation of Open and Post-publication Peer Review sites like Faculty of 1000, PubPeer, and Publons.
 
 Each shade of OPR has its advantages and disadvantages. Let?s take a closer look.
 
 Open Peer Review for journals
 Here?s how Open Peer Reviews work, more or less: reviewers are assigned to a paper, and they know the author?s identity. They review the paper and sign their name. The reviews are then submitted to the editor and author (who now knows their reviewers? identities, thanks to the signed reviews). When the paper is published, the signed reviews are published alongside it.
 
 Journals including BMJ and PeerJ require or allow Open Peer Reviews.
 
 Participating in journal-based OPR can be a good way to experiment with OPR as it?s officially sanctioned by the author, journal, and reviewer alike.
 
 One drawback to this type of Open Peer Review is that journals sometimes do not provide permanent identifiers for the reviews themselves, making it difficult to track the reach and impact of your review rather than for the journal article you?ve reviewed. Luckily, PeerJ is working to change that?they?re now issuing DOIs for Open peer reviews, which comprise 40% of their reviews.
 
 Third-party Open and Post-publication Peer Review sites
 In the past few years, a number of standalone, independent peer review sites have emerged: PubPeer, Publons, and Faculty of 1000 are among the many. These sites allow you to review both published and under-review papers on their platform, and in the case of Publons, export your reviews to journals for use.
 
 These sites also allow you to submit your reviews as Open Peer Reviews, and to create profiles showcasing your peer reviews. Some sites like Publons also issue DOIs for reviews, making them citable research objects.
 
 Blogging as Open Post-publication Peer Review
 In this type of Open Peer Review, academics take to their blogs to share their thoughts on a recently published paper or preprint. These reviews can run the gamut from highly-technical reviews oriented towards other scientists (a good example is this post on Rosie Redfield?s blog) to reviews written for a more general audience (like Mike Eisen?s post on the same study).
 
 A major advantage to blogging your Open Peer Reviews is that you don?t have to have permission to do it; you can just fire up your blog and start reviewing. But a downside is that the review isn?t formally sanctioned by the journal, and so can carry less weight than formal reviews.
 
 No matter what type of Open Peer Review you opt for, if it?s got your name attached to it and is available for all to read, you can use it to showcase your expertise in your area of research.",,1,1,0,1,1,1
"Swan, Alma",2006,Overview of scholarly communication,"In,ÿJacobs, Neilÿ(eds.)ÿOpen Access: Key Strategic, Technical and Economic Aspects.ÿ,ÿChandos",http://eprints.soton.ac.uk/id/eprint/262427,Journal articles,Book,Interdisciplinary,"""Some journals have already started experimenting with open peer review, where articles are posted on the Web for open discussion between peer group and author, are modified in the light of this and are then formally peer-reviewed by selected reviewers in the traditional way.""",,0,1,1,1,1,0
"Martin, Victoria",2014,Demystifying eResearch: A Primer for Librarians: A Primer for Librarians,ABC-CLIO,,Journal articles,Book,Interdisciplinary,"""Open peer review means that the reviewers' identities are disclosed, included on the peer review reports, and that these reports are (optionally) published alongside the article."" (p.69)",,1,1,0,0,0,0
"MacAuley, Domhnall",2012,The Role of the Manuscript Assessor,"In How to Write a Paper, edited by George M. Hall, 102?14. John Wiley & Sons, Ltd",,Journal articles,Book,Interdisciplinary,"""Many journals now use a completely open peer review system so that the identity of authors and reviewers are known to each other.""",,1,0,0,0,0,0
"Monsen, Elaine R., and Linda Van Horn",2007,Research: Successful Approaches,American Dietetic Association,,Journal articles,Book,STEM,"""Recently, some journals ... Have gone to what is called ""open peer review"" or ""unblinded review."" In this type of review, reviewers and authors are not blind to one another, and they can discuss questions raised by the review of the manuscript. Some journals provide open posting of the manuscript and reviewer comments on their Web sites and allow community comment.""",,1,1,1,1,0,0
"Su rez, Andrea L., Jeffrey D. Bernhard, and Robert P. Dellavalle",2012,Hiding Behind the Curtain: Anonymous versus Open Peer Review,"InÿDermatoethics: Contemporary Ethics and Professionalism in Dermatology, edited by Lionel Bercovitch and Clifford Perlis, 221-225. London: Springer,",,Journal articles,Book,STEM,"""open peer review occurs when there is no blinding and the author's and reviewer's names are known to each other.""",,1,0,0,0,0,0
"Benson, Philippa J., and Susan C. Silver",2012,What Editors Want: An Author?s Guide to Scientific Journal Publishing,University of Chicago Press,,Journal articles,Book,Interdisciplinary,"""in open peer review neither the authors nor the reviewers are anonymous; instead, everyone's name is visible.""",,1,0,0,0,0,0
"Morris, Sally, Ed Barnas, and Douglas LaFrenier",2013,The Handbook of Journal Publishing,Cambridge University Press,,Journal articles,Book,Interdisciplinary,"""Some journals use ""open peer review,"" and post the reviewers' (signed) commments made during peer review.""",,1,1,0,0,0,0
Ediqo,2016,What to Consider When Submitting Your Paper to an Open Peer-Review Journal,"Research Matters - Ediqo Blog, May 18, 2016",https://www.ediqo.com/blog/what-to-consider-when-submitting-your-paper-to-an-open-peer-review-journal/,Journal articles,Blog post,Interdisciplinary,"""Open peer-review journals provide online referee reports to readers alongside a published paper, working towards the goal of increasing transparency in academia and scholarly communications. Some open peer-review models also require referee identities to be revealed to authors or the public, which is usually done once a paper?s peer-review process has been completed.... A new type of open peer-review journal are those operating under the post-publication peer-review (PPPR) model. PPPR is also a form of open peer-review, where the referee reports and usually also the names of referees are openly published. PPPR has the advantage that a submitted paper is immediately published online as a kind of preprint before the peer-review process starts.""",,1,1,0,1,1,0
"Freire, Danilo",2015,Peering at Open Peer Review,"The Political Methodologist, December 8, 2015",https://thepoliticalmethodologist.com/2015/12/08/peering-at-open-peer-review/,Journal articles,Blog post,Interdisciplinary,"""Open peer review consists in requiring referees to sign their reports and requesting editors to publish the reviews alongside the final manuscripts""",,1,0,0,0,0,0
"Davis, Phil",2010,Weighing the Costs and Benefits of Open Peer-Review,"The Scholarly Kitchen, November 30, 2010",https://scholarlykitchen.sspnet.org/2010/11/30/weighing-the-costs-and-benefits-of-open-peer-review/,Journal articles,Blog post,Interdisciplinary,,"""The article, ?Effect on peer review of telling reviewers that their signed reviews might be posted on the web,? was published on November 16th in BMJ by Susan van Rooyen and others. Using a randomized controlled trial, reviewers were allocated to either the intervention group (open peer review) or the control group (reviews provided to the author). """,1,0,0,0,0,0
Wikipedia,2016,Open peer review,Wikipedia,https://en.wikipedia.org/wiki/Open_peer_review,Not specified,Other,Interdisciplinary,"Open peer review denotes several, closely related forms of scholarly peer review:
 - open-identity or attributed peer review (as opposed to anonymous peer review);
 - open-access or disclosed peer review, where the peer review contents are publicized;
 - open-invitation or unsolicited peer review, where anyone interested can join and contribute to the peer review process. In this case does not follow that peer-review is a gate-keeping process.",,1,1,1,0,0,0
Agricultural Information Management Standards (AIMS),2016,Opening up the review process with open peer review,Agricultural Information Management Standards (AIMS),http://aims.fao.org/activity/blog/opening-review-process-open-peer-review,Not specified,Blog post,Interdisciplinary,"With open peer review referee reports are made publicly available after the peer review process: each published article includes all peer review reports, reviewer names, and author responses ? even for articles that are still under review or revision.",,1,1,0,0,0,0