Authors,Year,Title,Otherbibinfo,DOIorURI,WhatReviewed,Type,Discipline,ExDef,ImDef,OpenIdentities,OpenReports,OpenInteraction,OpenParticipation,OpeninTime,OpenPlatforms
"Sandewall, Erik",2012,Maintaining live discussion in two-stageÿopen peer review,FRONTIERS IN COMPUTATIONAL NEUROSCIENCEÿÿVolume:ÿ6ÿÿÿÿÿArticle Number:ÿ9,10.3389/fncom.2012.00009,Journal articles,Article,STEM,"""The concept of ?open peer review? is presently being used for several fairly different models of peer review. A basic distinction can be made between open-names peer review which is similar to traditional peer review except that the identity of the reviewers is shown openly, and open-process peer review where interested parties are invited to join the peer review process that takes place before an article is accepted for a journal or other similar venue.""","""Open peer review has been proposed for a number of reasons, in particular, for increasing the transparency of the article selection process for a journal, and for obtaining a broader basis both for feedback to the authors, and for the acceptance decision. It has also been proposed that the contents of the reviewers? comments and of the authors? responses to them may in themselves be of interest to the community of researchers in the area of the work, and that they should therefore be published and preserved.""",1,1,1,1,1,0
"Sen, Chandan K.",2012,Rebound Peer Review: A Viable Recourse for Aggrieved Authors?,ANTIOXIDANTS & REDOX SIGNALINGÿÿVolume:ÿ16ÿÿÿIssue:ÿ4ÿÿÿPages:ÿ293-296ÿ,10.1089/ars.2011.4424,Journal articles,Article,STEM,"""open peer review has been adopted by a few journals (6). Here, authors know who the reviewers of their work are.""",,1,0,0,0,0,0
"Lee, Christopher",2012,Open peer reviewÿby a selected-papers network,FRONTIERS IN COMPUTATIONAL NEUROSCIENCEÿÿVolume:ÿ6ÿÿÿÿÿArticle Number:ÿ1,10.3389/fncom.2012.00001,Journal articles,Article,Interdisciplinary,,"""Peer review is open (non-anonymous)""",1,0,0,0,0,0
"Janowicz, Krzysztof; Hitzler, Pascal",2012,Open and transparent: the review process of the Semantic Web journal,LEARNED PUBLISHINGÿÿVolume:ÿ25ÿÿÿIssue:ÿ1ÿÿÿPages:ÿ48-55,10.1087/20120107,Journal articles,Article,STEM,,"""reviewers can notify the editors if they want to opt-out of the open review system and stay anonymous"" NOTE: Open Reports termed ""transparency""",1,0,0,0,0,0
"Leek, Jeffrey T.; Taub, Margaret A.; Pineda, Fernando J.",2011,Cooperation between Referees and Authors Increases Peer Review Accuracy,PLOS ONEÿÿVolume:ÿ6ÿÿÿIssue:ÿ11ÿÿÿÿÿArticle Number:ÿe26895,10.1371/journal.pone.0026895,"journals, awarding of grants, and academic promotion",Article,Interdisciplinary,,"""The goal of this study is to determine whether anonymous (closed) or non-anonymous (open) peer review results in more correct research being accepted.""",1,0,0,0,0,0
"Perakakis, Pandelis; Taylor, Michael; Mazza, Marco G.; et al.",2011,"Understanding the role ofÿopen peer reviewÿand dynamic academic articles: Authors' reply to ""Problems with natural selection of academic papers""",SCIENTOMETRICSÿÿVolume:ÿ88ÿÿÿIssue:ÿ2ÿÿÿPages:ÿ669-673ÿ,10.1007/s11192-011-0402-1,Journal articles,Article,Interdisciplinary,,"Open PR is not a new idea and many scholars already support that it is a viable solution to the numerous deficiencies of the current evaluation system [16, 17]. Our model proposes a fully-transparent PR process, whereby reviews by referees are posted online and tagged to the article in question. This allows the implementation of a reviewer evaluation system that will provide motivation for potential reviewers [18]. Referee efforts will be acknowledged and rewarded, thus enhancing their academic standing in the field. Such a mechanism will also help to solve the ??difficult to find reviewers?? and ??time limitation of the reviewers?? problems mentioned by L. Egghe. In our system, writing a good review could be scientifically as beneficial as contributing an original article. Furthermore, open PR will sidestep other serious concerns too, such as reviewers evaluating papers outside their area of expertise, or writing a positive review as a favour, since their review will be subject to open criticism from the scientific community.
 While L. Egghe holds that PR is guided by deontological rules, this is something that is not transparent in a blind PR system. On the contrary, open PR creates a public environment where everyone can judge and where every judgment can be weighted. The NSAP model turns what constitutes a weakness for classical journals into a strength for science and society. In the open environment we advocate, a large scientific community can assess the quality of a manuscript, or even discover frauds or sources of plagiarism a lot more efficiently than is possible today by two or three anonymous and unmotivated reviewers.... The open PR system presents the author with the opportunity to address the problem of visibility by being the driving force seeking reviewers and reviews, which will likely also increase article citation rates. /",1,1,1,1,1,0
"Boldt, Axel",2011,Extending ArXiv.org to AchieveÿOpen Peer Reviewÿand Publishing,JOURNAL OF SCHOLARLY PUBLISHINGÿÿVolume:ÿ42ÿÿÿIssue:ÿ2ÿÿÿPages:ÿ238-242,10.3138/jsp.42.2.238,Journal articles,Article,STEM,,"I propose the following extension to the arXiv.org preprint archive. A new class of users is created, the ?editors?. Each editor works for an electronic journal. Authors, after having uploaded a preprint to the archive, may elect to submit their article for review and official publication in one of these electronic journals. An editor of that journal then decides whether the article is appropriate for the journal in terms of scope and quality. If it is not, this decision is publicly attached to the article and the process ends; if it is, the editor invites one or more referees to write public reviews, to be attached to the article. The article author may subsequently post a public rebuttal to the reviews. Based on the referee reports and rebuttals, the editor decides whether to accept, demand changes to, or reject the article. The original article, reviews, rebuttal and publication decision are published in perpetuity. If accepted, the author posts a final version of the article to arXiv.org; as a peer reviewed and officially published article, it is visibly set apart from mere preprints and added to the electronic journal?s collection of published articles. Rejected articles may be submitted to another electronic journal. Reviews should be signed with the referee?s full name and affiliation. This maximizes transparency and allows referees to receive academic credit for their work.... It will also be desirable to attach a moderated discussion forum to each article, as a natural gathering place of interested researchers. The quality of these forums would serve as a criterion to differentiate electronic journals from each other.",1,1,1,1,1,1
"Groves, Trish",2010,Isÿopen peer reviewÿthe fairest system? Yes,BRITISH MEDICAL JOURNALÿÿVolume:ÿ341ÿÿÿÿÿArticle Number:ÿc6424,10.1136/bmj.c6424,Journal articles,Article,STEM,"Varying definitions of ?open? review include asking a wider community to come to the journal?s website and rate articles.5ÿOpen review at theÿBMJÿcurrently means that all reviewers sign their reports, declare their competing interests, and desist from making additional covert comments to the editors.6ÿ",open peer review at theÿBMJ = OpenID?,1,1,0,1,0,0
"Khan, Karim",2010,Isÿopen peer reviewÿthe fairest system? No,BRITISH MEDICAL JOURNALÿÿVolume:ÿ341ÿÿÿÿÿArticle Number:ÿc6425,10.1136/bmj.c6425,Journal articles,Article,STEM,,"OpenID - ""Open peer review is associated with the risk that an inferior paper written by a senior authority in the field may receive a ?soft? or generous review from a junior reviewer who either seeks to curry favour or fears an honest review would lead to payback at some future time.""",1,0,0,0,0,0
"van Rooyen, Susan; Delamothe, Tony; Evans, Stephen J. W.",2010,Effect on peer review of telling reviewers that their signed reviews might be posted on the web: randomised controlled trial,BRITISH MEDICAL JOURNALÿÿVolume:ÿ341ÿÿÿÿÿArticle Number:ÿc5729,10.1136/bmj.c5729,Journal articles,Article,STEM,,"""signed reviews might be posted on the web"", ""Reviewers who knew that their report might be posted online spent longer on the task than those in the control group, so adopting open peer review might result in the process feeling even more arduous to reviewers than it currently does.""",1,1,0,0,0,0
"Sekhar, D. M. R.; Aery, Naresh Chander",2010,Open Reviewÿof Science Publications,ACCOUNTABILITY IN RESEARCH-POLICIES AND QUALITY ASSURANCEÿÿVolume:ÿ17ÿÿÿIssue:ÿ5ÿ,10.1080/08989621.2010.511548,Not specified,Article,Interdisciplinary,,"""Even peer reviewed journals may follow open review to improve credibility of the journals by publishing the comment and the identity of the peer.""",1,1,0,0,0,0
"Bekkering, Geertruida E.; Kleijnen, Jos",2008,Procedures and methods of benefit assessments for medicines in Germany,EUROPEAN JOURNAL OF HEALTH ECONOMICSÿÿVolume:ÿ9ÿÿÿSupplement:ÿ1ÿÿÿPages:ÿS5-S29,10.1007/s10198-008-0122-5,Medicines,Article,STEM,"""implement open peer review by publishing both the comments of the reviewers and their names""",,1,1,0,0,0,0
"Baggs, Judith Gedney; Broome, Marion E.; Dougherty, Molly C.; et al.",2008,Blinding in peer review: the preferences of reviewers for nursing journals,JOURNAL OF ADVANCED NURSINGÿÿVolume:ÿ64ÿÿÿIssue:ÿ2ÿÿÿPages:ÿ131-138,10.1111/j.1365-2648.2008.04816.x,Journal articles,Article,STEM,,"""Double-blinding was the method preferred by 93.6% of reviewers, although some identified some advantages to an unblinded open review process."", ""Reviewers were asked, ?Which of the following are advantages of making reviews open to the public??. They could mark any or all of five possible advantages, which many did (Table 1). For the 87 responses to ?Other?, content analysis demonstrated that by far the most frequently discussed advantage (n = 51; 58’6%) related to use of open review as an educational opportunity, for novice researchers, authors, reviewers, or students, or as a learning tool even for those with more experience. As one respondent put it, ?Writing reviews requires knowledge and skill ? all reviewers and prospective reviewers can learn about this skill by reading a variety of them?.""",1,1,0,0,0,0
"Stefanou, Spiro E.; Kerstens, Kristiaan",2008,Applied production analysis unveiled inÿopen peer review: introductory remarks,JOURNAL OF PRODUCTIVITY ANALYSISÿÿVolume:ÿ30ÿÿÿIssue:ÿ1ÿÿÿPages:ÿ1-+,10.1007/s11123-008-0091-9,Not specified,Article,STEM,"?a process of open peer review, a variation on the widespread use of single- and double-blind refereeing processes in most economic journals where the identity of both authors and referees is common knowledge throughout the refereeing process.... The availability of the referee reports is the essence of the open peer reviewing process with the clear separation between initial manuscripts and the replies to the referees shedding light on the context of discovery.?",,1,1,0,0,0,0
"Aguilar-Ruiz, Jesus S.; Moore, Jason H.; Ritchie, Marylyn D.",2008,Filling the gap between biology and computer science,BIODATA MININGÿÿVolume:ÿ1ÿÿÿÿÿArticle Number:ÿUNSP 1,10.1186/1756-0381-1-1,Journal articles,Article,STEM,"""In order to make the peer review process transparent Bio-Data Mining has adopted an open-review policy. Reviewers' names are included on the peer review reports and are made publically available upon acceptance of an article. We believe that this will foster constructive reviews, and therefore enrich the criticism. This policy will contribute greatly in driving young researchers to improve the quality of their articles.""",,1,1,0,0,0,0
"Menz, Hylton B.; Potter, Mike J.; Borthwick, Alan M.; et al.",2008,Welcome to Journal of Foot and Ankle Research: a new open access journal for foot health professionals,JOURNAL OF FOOT AND ANKLE RESEARCHÿÿVolume:ÿ1ÿÿÿÿÿArticle Number:ÿ1,10.1186/1757-1146-1-1,Not specified,Article,STEM,"As BMC standard ""JFAR operates a fully open peer review system, meaning that the identity of the authors is known to the reviewers, and vice versa. There is no evidence that such a system produces better quality reviews or changes reviewers' recommendations compared to traditional ""closed"" peer review [24]. However, open peer review is a far more transparent system, potentially fosters greater accountability on the part of reviewers, and may also prevent potentially serious abuses of the system (such as reviewers stealing authors' ideas or intentionally slowing the progress of a competitor's manuscript) [21]. All correspondence pertaining to the peer review process, including peer reviewers' comments, authors' replies and revisions of the manuscript will be freely accessible from the 'prepublication history' section""",,1,1,0,0,0,0
"Dougherty, Molly (Mickey) C.",2007,Open peer reviewÿ3 years later,NURSING RESEARCHÿÿVolume:ÿ56ÿÿÿIssue:ÿ5ÿÿÿPages:ÿ295-295ÿ,10.1097/01.NNR.0000289496.14790.bb,Not specified,Article,STEM,,"OPR in Nursing Research journal - OpenID, OpenReports",1,1,0,0,0,0
"Liu, S. V.",2007,"Why are people reluctant to join inÿopen review? (vol 447, pg 1052, 2007)",NATUREÿÿVolume:ÿ448ÿÿÿIssue:ÿ7152ÿÿÿPages:ÿ408-408,10.1038/448408e,Journal articles,Letter,STEM,,"OPR as in 2006 Nature experiment (""between 1 June and 30 September 2006, we invited authors of newly submitted papers that survived the initial editorial assessment to have them hosted on an open server on the Internet for public comment. For those who agreed, we simultaneously subjected their papers to standard peer review. We checked all comments received for open display for potential legal problems or inappropriate language, and in the event none was held back. All comments were required to be signed. Once the standard process was complete (that is, once all solicited referees' comments had been received), we also gathered the comments received on the server, and removed the paper."", http://www.nature.com/nature/peerreview/debate/nature05535.html)",1,1,0,1,1,0
"Faloutsos, Michalis; Rejaie, Reza; Banerjee, Anirban",2007,You must be joking ... A historic open reviewing at Global Internet '07,ACM SIGCOMM COMPUTER COMMUNICATION REVIEWÿÿVolume:ÿ37ÿÿÿIssue:ÿ3ÿÿÿPages:ÿ79-82ÿ,10.1145/1273445.1273457,Conference papers,Article,STEM,"""Global Internet 2007, chaired by Rejaie and Faloutsos, had an open review process: the names of the reviewers were revealed to the authors and, in addition, reviews of accepted papers are published in a website for anyone to see.""",,1,1,0,0,0,0
"Liu, Shi V.",2007,Why are people reluctant to join inÿopen review?,NATUREÿÿVolume:ÿ447ÿÿÿIssue:ÿ7148ÿÿÿPages:ÿ1052-1052,10.1038/4471052d,Journal articles,Letter,STEM,,OPR as in 2006 Nature experiment,1,1,0,1,1,0
[Anonymous],2007,Nature abandonsÿopen peer review,PSYCHOLOGISTÿÿVolume:ÿ20ÿÿÿIssue:ÿ3ÿÿÿPages:ÿ133-133,https://thepsychologist.bps.org.uk/volume-20/edition-3/news,Journal articles,Article,STEM,,OPR as in 2006 Nature experiment,1,1,0,1,1,0
"Jones, Alan Wayne",2007,"The distribution of forensic journals, reflections on authorship practices, peer-review and role of the impact factor",FORENSIC SCIENCE INTERNATIONALÿÿVolume:ÿ165ÿÿÿIssue:ÿ2-3ÿÿÿPages:ÿ115-128,10.1016/j.forsciint.2006.05.013,Not specified,Article,STEM,"""The so-called open-access journals, which are increasing in number, such as those produced by the Biomedical Central (BMC), e.g. BMC Clinical Pharmacology, post on the web the entire pre-publication history of the manuscripts accepted for publication. The date the manuscript was received, the reviewer reports and the names of the reviewers as well as the response from the authors and any rewrites of the manuscript are available on-line for all to read.""",,1,1,0,0,0,0
"Stamm, Thomas; Meyer, Ulrich; Wiesmann, Hans-Peter; et al.",2007,"A retrospective analysis of submissions, acceptance rate,ÿopen peer reviewÿoperations, and prepublication bias of the multidisciplinary open access journal Head & Face Medicine",Head & face medicineÿÿVolume:ÿ3ÿÿÿPages:ÿ27ÿ,10.1186/1746-160X-3-27,Journal articles,Article,STEM,,"As Head&Face ""Head & Face Medicine operates an open peer-review system, where the reviewers' names are included on the peer-review reports. In addition, if the article is published, the named reports are published online alongside the article as part of an 'Open Peer Review reports'.""",1,1,0,0,0,0
"Pharaon, Sadek",2007,Open peer review: a route to democracy,JOURNAL OF THE ROYAL SOCIETY OF MEDICINEÿÿVolume:ÿ100ÿÿÿIssue:ÿ1ÿÿÿPages:ÿ9-9ÿ,10.1258/jrsm.100.1.9-a,Journal articles,Article,STEM,,"As in Journal of the Royal Society of Medicine (2007) + Open Interaction ""Anybody submitting an article can discuss with the peer-reviewer any differences of opinion, without causing any bitter after-sentiments.""",1,0,1,0,0,0
"Morrison, Jill",2006,The case forÿopen peer review,MEDICAL EDUCATIONÿÿVolume:ÿ40ÿÿÿIssue:ÿ9ÿÿÿPages:ÿ830-831,10.1111/j.1365-2929.2006.02573.x,Not specified,Article,STEM,,"""unblinded, open peer review""",1,0,0,0,0,0
"Abbasi, Kamran",2006,JRSM introducesÿopen peer review,JOURNAL OF THE ROYAL SOCIETY OF MEDICINEÿÿVolume:ÿ99ÿÿÿIssue:ÿ8ÿÿÿPages:ÿ379-379,10.1258/jrsm.99.8.379,Not specified,Article,STEM,"""open peer review?where authors and reviewers know each others? identities?from this September onwards. It will become one of the world?s very few journals with an open peer review process. The reviewer?s comments will not yet be published though that is the logical next step.""",,1,0,0,0,0,0
"Richards, L",2006,Publishing - Nature trial nurturesÿopen peer review,CHEMISTRY & INDUSTRYÿÿIssue:ÿ12ÿÿÿPages:ÿ4-4,,Not specified,New item,STEM,,OPR as in 2006 Nature experiment,1,1,0,1,1,0
"Ross, JS; Gross, CP; Desai, MM; et al.",2006,Effect of blinded peer review on abstract acceptance,JAMA-JOURNAL OF THE AMERICAN MEDICAL ASSOCIATIONÿÿVolume:ÿ295ÿÿÿIssue:ÿ14ÿÿÿPages:ÿ1675-1680,10.1001/jama.295.14.1675,Conference papers,Article,STEM,"NOT OpenID - Mean Single-Blind RVW ""Abstract review included the author?s name and institution (open review) from 2000-2001"" -",,1,0,0,0,0,0
"Farthing, MJG",2006,Authors and publication practices,SCIENCE AND ENGINEERING ETHICSÿÿVolume:ÿ12ÿÿÿIssue:ÿ1ÿÿÿSpecial Issue:ÿSIÿÿÿPages:ÿ41-52,10.1007/PL00022267,Journal articles,Article,STEM,"""?open? peer review in which both the authors and the reviewers are known to each other.""",,1,0,0,0,0,0
"Kearney, MH; Freda, MC",2005,Nurse editors' views on the peer review process,RESEARCH IN NURSING & HEALTHÿÿVolume:ÿ28ÿÿÿIssue:ÿ6ÿÿÿPages:ÿ444-452,10.1002/nur.20104,Journal articles,Article,STEM,"""open review (both author and reviewer identities are known to each other)""","""The majority of nurse editors reported that blinding was important in peer review, tomaintain objectivity and avoid negative personal or professional consequences. The minority who saw potential benefits of open review valued increased transparency in the reviewing and editorial decision-making process."", ""one journal?s recent move toward open review still retain anonymity of both parties until after a decision is made (Dougherty, 2004).""",1,0,0,0,0,0
"Stamm, Thomas",2005,Head & Face Medicine - a new journal for 'intra-interdisciplinary' science. Why? When? Where?,Head & face medicineÿÿVolume:ÿ1ÿÿÿPages:ÿ1ÿ,10.1186/1746-160X-1-1,Journal articles,Article,STEM,,OPR as in BMC journal Head&Face,1,1,0,0,0,0
"Dougherty, MC",2004,Open peer reviewÿ- A first step,NURSING RESEARCHÿÿVolume:ÿ53ÿÿÿIssue:ÿ4ÿÿÿPages:ÿ213-213ÿ,10.1097/00006199-200407000-00001,Journal articles,Article,STEM,"""Open peer review, narrowly defined, means that the reviewer signs his or her review.""","""To begin the open review process, we selected manuscripts that received informative, constructive reviews (Beck in this issue; Choe and colleagues, forthcoming). The authors and reviewers gave permission for posting their reviews after the fact (a deviance from usual open peer review). Correspondence from the author and editor are posted also (see Open Manuscript Review highlighted on the home page at http://sonweb.unc.edu/nursing-research-editor).""",1,1,0,0,0,0
"Ludbrook, J",2003,Peer review of biomedical manuscripts: an update,JOURNAL OF CLINICAL NEUROSCIENCEÿÿVolume:ÿ10ÿÿÿIssue:ÿ5ÿÿÿPages:ÿ540-542,10.1016/S0967-5868(03)00091-2,Journal articles,Article,STEM,"""truly open peer review, in which the names of authors and their affiliations are revealed to reviewers, and the names of reviewers to authors""",,1,0,0,0,0,0
"Warr, WA",2003,Evaluation of an experimental chemistry preprint server,JOURNAL OF CHEMICAL INFORMATION AND COMPUTER SCIENCESÿÿVolume:ÿ43ÿÿÿIssue:ÿ2ÿÿÿPages:ÿ362-373,10.1021/ci025627a,Journal articles,Article,STEM,,"""In theory, preprints, together with version control and online discussion, could be a useful compromise: rapid prepublication followed by open peer review, before publication in a traditional journal.""",0,0,0,1,1,0
"Godlee, F",2002,"Making reviewers visible - Openness, accountability, and credit",JAMA-JOURNAL OF THE AMERICAN MEDICAL ASSOCIATIONÿÿVolume:ÿ287ÿÿÿIssue:ÿ21ÿÿÿPages:ÿ2762-2765,10.1001/jama.287.21.2762,Not specified,Article,STEM,,"""There are strong arguments in favor of retaining reviewer anonymity.... To counter these concerns, I suggest 4 arguments in favor of open review""",1,0,0,0,0,0
"Melero, R; Lopez-Santovena, F",2001,Referees' attitudes towardÿopen peer reviewÿand electronic transmission of papers,FOOD SCIENCE AND TECHNOLOGY INTERNATIONALÿÿVolume:ÿ7ÿÿÿIssue:ÿ6ÿÿÿPages:ÿ521-527,,Not specified,Article,SSH,"""The peer review system is opened when the authors know the reviewers and vice versa""",,1,0,0,0,0,0
"Lee, M; Om, K; Koh, J",2000,The bias of sighted reviewers in research proposal evaluation: A comparative analysis of blind andopen reviewÿin Korea,SCIENTOMETRICSÿÿVolume:ÿ48ÿÿÿIssue:ÿ1ÿÿÿPages:ÿ99-116,10.1023/A:1005636503358,Grant proposals,Article,Interdisciplinary,,"discusses blinded vs ""sighted review""",1,0,0,0,0,0
"Walsh, E; Rooney, M; Appleby, L; et al.",2000,Open peer review: a randomised controlled trial,BRITISH JOURNAL OF PSYCHIATRYÿÿVolume:ÿ176ÿÿÿPages:ÿ47-51,10.1192/bjp.176.1.47,Journal articles,Article,STEM,,"""For an open system to be practical, reviewers would have to be in favour of signing, and the quality of reviews produced ought not to be of inferior quality.""",1,0,0,0,0,0
Nature Neuroscience,1999,Pros and cons ofÿopen peer review,NATURE NEUROSCIENCEÿÿVolume:ÿ2ÿÿÿIssue:ÿ3ÿÿÿPages:ÿ197-198,,Journal articles,Article,STEM,,"""Anonymous peer review, despite the criticisms often leveled against it, is used in more or less the same form by the great majority of scientific journals. The British Medical Journal (BMJ), however, has recently taken the bold step of abolishing referee anonymity, and now requires all referees to identify themselves to the authors. The editor, Richard Smith, justifies this move primarily on ethical grounds, arguing1 that ?a court with an unidentified judge makes us think immediately of totalitarian states and the world of Franz Kafka?. Many other journals, including Nature Neuroscience, will await the results of this experiment with interest. Yet, whatever the results, there are a number of reasons to think that open review may not be the best solution for all journals.""",1,0,0,0,0,0
"van Rooyen, S; Godlee, F; Evans, S; et al.",1999,Effect ofÿopen peer reviewÿon quality of reviews and on reviewers' recommendations: a randomised trial,BRITISH MEDICAL JOURNALÿÿVolume:ÿ318ÿÿÿIssue:ÿ7175ÿÿÿPages:ÿ23-27,http://dx.doi.org/10.1136/bmj.318.7175.23,Journal articles,Article,STEM,"""asking reviewers to have their identity revealed to the authors of the paper""",,1,0,0,0,0,0
"Bingham, CM; Higgins, G; Coleman, R; et al.",1998,The Medical Journal of Australia Internet peer-review study,LANCETÿÿVolume:ÿ352ÿÿÿIssue:ÿ9126ÿÿÿPages:ÿ441-445,10.1016/S0140-6736(97)11510-0,Journal articles,Article,STEM,"""Research and review articles that had been accepted for publication in The Medical Journal of Australia (MJA) were published together with the reviewers? reports on the worldwide web, with the consent of authors and referees. Selected readers? e-mailed comments were electronically published as additional commentary; authors could reply or revise their paper in response to readers? comments. Articles were edited and published in print after this open review.""",,1,1,1,1,1,0
"Lightfoot, JT",1998,A different method of teaching peer review systems,ADVANCES IN PHYSIOLOGY EDUCATIONÿÿVolume:ÿ19ÿÿÿIssue:ÿ1ÿÿÿPages:ÿS57-S61ÿ,http://www.ncbi.nlm.nih.gov/pubmed/9841565,Journal articles,Article,SSH,"""In the open system, the author knows the identity of the reviewer and the reviewer knows the identity of the author.""",,1,0,0,0,0,0
