Authors,Year,Title,Otherbibinfo,DOIorURI,WhatReviewed,Type,Discipline,ExDef,ImDef,OpenIdentities,OpenReports,OpenInteraction,OpenParticipation,OpeninTime,OpenPlatforms
"JUSTESEN, DR",1995,AN EXERCISE INÿOPEN PEER-REVIEW,BIOELECTROMAGNETICSÿÿVolume:ÿ16ÿÿÿIssue:ÿ1ÿÿÿPages:ÿ1-1,10.1002/bem.2250160102,Journal articles,Article,STEM,"The model of open peer review that was chosen for this exercise is that of the late Paul Arthur Schilpp of Northwestern University. Examples of the model are sizable tomes edited by Schilpp j1944, 19491. In these works a summing-up of theoretical/philosophical reflections by Albert Einstein and Bertrand Russell were thoroughly vetted by some of their peers. These commentaries were commented on in turn by the featured author. There is a downside to open peer review. It is extremely time consuming. An author must be recruited whose works have garnered editorial interest and acclaim. He or she must then be willing to submit a paper for an initial anonymous peer review. If the review is favorable, the author must submit the opus to scrutiny by a team of ?open? reviewers. The ensuing critiques may themselves require outside review. Finally, the author composes replies to reviewers.",,1,1,1,1,0,0
"BORNSTEIN, RF",1993,COSTS AND BENEFITS OF REVIEWER ANONYMITY - A SURVEY OF JOURNAL EDITORS AND MANUSCRIPT REVIEWERS,JOURNAL OF SOCIAL BEHAVIOR AND PERSONALITYÿÿVolume:ÿ8ÿÿÿIssue:ÿ3ÿÿÿPages:ÿ355-370,,Journal articles,Article,SSH,"""a system wherein reviewers' identities are routinely revealed to authors of submitted manuscripts (i.e., an ""open review"" system)",,1,0,0,0,0,0
"ARMSTRONG, JS; LUSK, EJ",1983,THE ACCURACY OF ALTERNATIVE EXTRAPOLATION MODELS - ANALYSIS OF A FORECASTING COMPETITION THROUGHÿOPEN PEER-REVIEW,JOURNAL OF FORECASTINGÿÿVolume:ÿ2ÿÿÿIssue:ÿ3ÿÿÿPages:ÿ259-,,Journal articles,Article,SSH,"In 1982, the Journal of Forecasting published the results of a forecasting competition organized by Spyros Makridakis (Makridakis era/,. 1982)?. In the belief that this study was of major importance, we decided to obtain a more complete discussion of the results. We do not believe that 'the data speak for themselves'?. In seeking peer review of the Makridakis competition, we drew heavily upon the procedures used by Behatioral and Brain Sciences, a journal that has been one of the pioneers for open peer review (Harnad. 1979), One objective was to provide a forum for discussion by experts who were likely to have different perspectives. We invited 14 outside experts to write commentaries on the Makridakis competition. Of these, eight agreed and seven completed their papers. The commentators are all from different organizations. Three are practitioners and four are academicians. We asked these commentators to address any aspect of the original paper. They were given approximately five months to write their commentary. We reviewed each commentary and made suggestions for change (sometimes with more than one round of revisions). Later, the commentators were provided with papers by the other commentators and were given a further opportunity for revisions. Finally, the commentators and authors were provided with edited versions of all papers and were given an opportunity to clarify their own papers and to suggest clarifications in other papers. A second objective was to obtain the viewpoints of the original authors speaking freely without any need for agreement from their co-authors. We also sent the commentaries to each of the nine original authors. We received replies from seven of the nine authors.",,1,1,1,1,1,0
"Jubb, M.",2016,Peer review: The current landscape and future trends,"Learned Publishing, 29, 1",10.1002/leap.1008,Journal articles,Article,Interdisciplinary,"?Open review, where both authors? and reviewers? names are revealed.? (Jubb 2016, 16)",,1,0,0,0,0,0
"Larson, Bradley P., and Kevin C. Chung",2012,A Systematic Review of Peer Review for Scientific Manuscripts,HAND 7 (1) 37?44,10.1007/s11552-012-9392-6,Journal articles,Article,STEM,"?A few of the papers discussed the benefits and downsides to open peer review. Open peer review can encourage reviewers to be more complete and constructive when their identity is not obscured [10]. Under an open peer-review system, referees are able to receive acknowledgment by authors instead of remaining anonymous [13]. As with single-blinded reviews, open peer review makes the author?s identity known to the reviewer. This has the potential to expose an author to biases regarding their previous work, nationality, or gender [28, 46]. However, conflicting studies argue that open review does not bring any real advantages and requires further evaluation [13, 19].?(Larson and Chung 2012, 42)",,1,0,0,0,0,0
"Pontille, David, and Didier Torny",2015,From Manuscript Evaluation to Article Valuation: The Changing Technologies of Journal Peer Review,Human Studies 38 (1): 57?79,10.1007/s10746-014-9335-z,Journal articles,Article,SSH,,"""Developed as an alternative to the single blind as from the early 1980s, ??open review?? was for a long time limited to just a few journals which encouraged or required their reviewers to sign their reports (Knox 1981).""",1,0,0,0,0,0
"Ware, Mark",2008,"Peer Review: Benefits, Perceptions and Alternatives (Publishing Research Consortium Summary Paper 4)",,http://citeseerx.ist.psu.edu/viewdoc/download?doi=10.1.1.214.9676&rep=rep1&type=pdf,Journal articles,Community report,Interdisciplinary,"""A newer approach to dealing with the criticisms of single-blind review is open peer review: in this model, the author?s and reviewers? identities are known to each other, and the reviewers? names and (optionally) their reports are published alongside the paper. Advocates of open review see it as much fairer because, they argue, somebody making an important judgement on the work of others should not do so in secret. It is also argued that reviewers will produce better work and avoid offhand, careless or rude comments when their identity is known.? (Ware 2008, 6)",,1,0,0,0,0,0
"Birukou, Aliaksandr et al",2011,Alternatives to Peer Review: Novel Approaches for Research Evaluation,Frontiers in Computational Neuroscience 5 (December),10.3389/fncom.2011.00056,Journal articles,Article,STEM,?open peer review where both authors and reviewers are aware of each other?s identity? (Birukou et al. 2011),,1,0,0,0,0,0
"Mulligan, Adrian, Louise Hall, and Ellen Raphael",2013,Peer Review in a Changing World: An International Study Measuring the Attitudes of Researchers,Journal of the American Society for Information Science and Technology 64 (1): 132?61,10.1002/asi.22798,Journal articles,Article,Interdisciplinary,"?Open peer review, in which both the reviewer and the author are known to one another, increases transparency and encourages honest open responses.?(Mulligan, Hall, and Raphael 2013, 133)",,1,0,0,0,0,0
Research Information Network,2010,Peer Review: A Guide for Researchers,,http://www.rin.ac.uk/system/files/attachments/Peer-review-guide-screen.pdf,Journal articles,Community report,Interdisciplinary,"""Open review: this term is used to cover at least three different kinds of arrangement with increasing levels of transparency:
 ? the identities of reviewers and submitters are revealed to each other
 ? the signed reviews themselves are passed in full to the applicants, and
 ? authors? draft publications are made available on websites and reviews and comments are invited from anyone who wishes to do so""",,1,1,0,1,1,0
Sense About Science,2012,Peer Review: The Nuts and Bolts: A Guide for Early Career Researchers (Standing up for Science 3),,http://www.senseaboutscience.org/data/files/resources/99/Peer-review_The-nuts-and-bolts.pdf,Journal articles,Community report,Interdisciplinary,"""OPEN REVIEW: At its most basic, reviewers know who the authors are and the authors know who the reviewers are. It can also mean inclusion of the reviewers? names and/or reports alongside the published paper, comments from others [subject community or wider public] at pre-publication stage, or various combinations of these.""",,1,1,0,1,1,0
"Tennant, J and Mounce, R",2015,Open Research Glossary,,10.6084/m9.figshare.1482094.v1,Journal articles,Glossary,Interdisciplinary,"?Open review - when reviews are made openly available, typically alongside the article.? / ?Signed peer review - when the individual reviews are publicly signed by those who conducted them.? (Tennant and Mounce 2015)",,0,1,0,0,0,0
"Sumner, Tamara and Buckingham Shum, Tamara",1996,Open Peer Review & Argumentation: Loosening the Paper Chains on Journals,"Ariadne, Issue 5",http://www.ariadne.ac.uk/issue5/jime,Journal articles,Article,Interdisciplinary,"""The article under review and the reviewers' initial comments are then published on the Web, and the review process moves into a phase of open peer review, in which authors, reviewers and readers can engage in debate.""",,0,0,1,0,1,0
"Armstrong, J. Scott",1997,"Peer Review for Journals: Evidence on Quality Control, Fairness, and Innovation",Science and Engineering Ethics 3 (1): 63?84,doi:10.1007/s11948-997-0017-3.,Journal articles,Article,Interdisciplinary,,"?publish controversial papers along with comments by reviewers? (Armstrong 1997, 75)",0,1,0,0,0,0
"Ware, Mark",2009,Current Peer Review Practice and Perceptions: The View from the Field,"Against the Grain 21, no. 3",doi:10.7771/2380-176X.2307,Journal articles,Article,Interdisciplinary,"?A newer approach to dealing with bias is open peer review, in which author?s and reviewer?s names are known to each other, and the reviewer?s name (and optionally, their report) is published alongside the article.? (Ware 2009, 20)",,1,1,0,0,0,0
"Shatz, David",1996,Is Peer Review Overrated?,The Monist 79 (4): 536?63,,Journal articles,Article,SSH,"?Open peer review is review by the scholarly community at large, instead of a few anonymous referees along with an editor or board.? (Shatz 1996, 538)",,0,0,0,1,0,0
"Nentwich, Michael",2005,Quality Control in Academic Publishing: Challenges in the Age of Cyberscience,Poiesis & Praxis 3 (3): 181?98,doi:10.1007/s10202-004-0071-8,Journal articles,Article,SSH,"?Open peer review/commentary While traditionally, the research community at large only finds out about the submission once it is printed, open forms of reviewing in e-journals announce that a paper has been submitted. The submission is uploaded to the journal?s server and everyone can have a look at it. In the case of revisions (along the path from the original submission to the final published text) the interim steps are also visible. In addition, the editor does not select referees, but opens a general, open debate about the manuscript. Self-appointed referees (Sumner and Shum 1997) comment on the merits of the paper online. In general, both the author?s and the public referees? identities are not disguised. While there are good arguments in favour of anonymity, the primary argument against it is that it seems wrong for somebody to make an important judgement on the work of others in secret (Smith 1999). Although, in principle, the technology allows for anonymity, it is not implemented because it would not suit well the otherwise open character of the procedure. The philosophy behind open peer review is basically that it is expected that the more people participate in the review process, the better the result. An open, non-anonymous procedure would be more ??democratic??, less determined by a single editor or a small board. In addition, the author is not only at the receiving end of a decision already taken, but in a position to participate in the review process through interactive means. While reviewing in the traditional model is a solitary activity, the open communicative process may lead to a discourse in which the ideas are refined and shaped.? (Nentwich 2005, 183)",,1,1,1,1,1,0
"Shaffer, Kris P",2014,A Proposal for Open Peer Review,"Music Theory Online 20, no. 1 (February 1, 2014)",http://mtosmt.org/issues/mto.14.20.1/mto.14.20.1.shaffer.html,Journal articles,Article,SSH,"?While multiple practices exist that can be considered manifestations of open peer review, open peer review in its fullest sense takes the scholarly discussion that traditionally follows publication ? and moves it pre-publication, rendering them part of the review process. Open peer review ensures high visibility for the best work, extensive vetting by the scholarly community pre-publication, and a timely publication process, all the while maintaining high standards for peer-reviewed publication.... Since this open peer-review model would be based around pre-published material on the web, it would generally lead to shorter publications than traditional publishing. Articles that work well for open peer review tend to be shorter, much more targeted, and have a much shorter bibliography than traditional articles, even when they represent the same level of research quality. Lastly, just as authors would need to be more comfortable sharing ideas that may not be camera-ready, reviewers need to be more comfortable sharing their comments, including critical ones, on the open web for such a project to work. Blind peer review protects reviewers as much as authors. Open peer review may be a non-starter for those used to providing their comments anonymously.? (Shaffer 2014, 1)",,1,1,1,1,1,0
"Hames, Irene",2014,The Changing Face of Peer Review,Science Editing 1 (1): 9?12,doi:10.6087/kcse.2014.1.9,Journal articles,Article,Interdisciplinary,"??Open? peer review, which originally meant just the author knowing who the reviewer was, can now cover a number of things, e.g., the reviewers? names being disclosed with the published article, reviewer reports being published (with or without names), the wider community being able to comment during review, and various combinations of these.? (Hames 2014, 10)",,1,1,0,1,1,0
"Fitzpatrick, Kathleen, and Avi Santo",2016,Open Review: A Study of Contexts and Practices (The Andrew W. Mellon Foundation White Paper),,https://mellon.org/media/filer_public/20/ff/20ff03e0-17b0-465b-ae82-1ed7c8cef362/mediacommons-open-review-white-paper-final.pdf,Not specified,,Interdisciplinary,"?Openness: As previously stated, openness can take several forms. Options include public access to and participation in the review process; removing the anonymity amongst authors and reviewers; establishing a means of greater back-and-forth between authors and reviewers and amongst reviewers. Each option presents benefits and challenges. For example, making the review process public can help render scholarly processes transparent, but may also blur distinctions between peer groups, as individuals with varying degrees and forms of expertise become parªticipants. Of course, the latter is only a ?downside? if this is not a desired outcome of openness. Ultimately, open review communities must determine the types and degrees of openness they will pursue in relation to the desired outcomes of the peer review process. Broadly, decisions about openness encompass: the choice between anonymity, pseudonymity, and transparency in representing reviewer and author identities; the choice to open up the review process to public viewing and/or participation; and the choice to allow and encourage reciprocity between authors and reviewers, as well as amongst reviewers.? (Fitzpatrick and Santo 2016, 18)",,1,1,1,1,1,0
"Shotton, David",2012,The Five Stars of Online Journal Articles - a Framework for Article Evaluation,"D-Lib Magazine 18, no. 1/2 (January 2012)",10.1045/january2012-shotton,Journal articles,Article,Interdisciplinary,"""The whole review process is entirely transparent. Each submitted manuscript is immediately made available on the journal's website. Reviews and comments from readers are welcomed, and are considered alongside the formal peer reviews solicited from experts by the journal. All the reviews, the author's responses, and the original and final versions of the article are published, and the appointed reviewers and editors are acknowledged by name in the final version. BMJ Open practices such open peer review, and the Semantic Web Journal strongly encourages it, while allowing reviewers the option of remaining anonymous.""",,1,1,0,1,1,0
"Ware, Mark",2011,Peer Review: Recent Experience and Future Directions,New Review of Information Networking 16 (1): 23?53,10.1080/13614576.2011.566812,Journal articles,Article,Interdisciplinary,"?The term open review is used confusingly to refer to several related but different variants of peer review, and it is worth taking a moment to identify these since it is not always clear in debates over the merits of open peer review exactly what is being referred to. (See also Hodgkinson 2007.) The ""openness"" in review can refer to: 
 ? the lack of blinding of the reviewer's identity. There can be several variants of this: the reviewers' names can be made known to the author (that is, the reports are signed) but are not made public (as at the BMJ, the Journal of the Royal Society of Medicine and BioMed Central medical journals), or alternatively the reviewers' names can be made public and attached to the published paper. It is also possible for the reviewers to remain anonymous during the process of review but for their names subsequently to be revealed and published alongside the paper. Another variant is to allow the author to nominate the referees (as at Biology Direct).
 ? access to the reviewer's reports and the associated author responses and other documentation. The review process can take place in the open, with the submitted manuscript, reviewer reports, author responses and editor's comments etc. made available in real time; this is the approach adopted at the journal Atmospheric Chemistry & Physics. Alternatively, the reviewing documents can be published simultaneously with the paper (e.g. as at The EMBO Journal ). An additional requirement can be that the reviewer does not provide confidential comments to the editor in addition to the report that is made available to the author.
 ? the pool of people able to comment on the submitted manuscripts, i.e. opening this up to the wider community rather than relying on two or three reviewers selected by the editor. This approach can take place after publication (see Post-publication peer review, below) or prior to publication (as at Atmospheric Chemistry & Physics or at the Nature peer review trial). The intended reviewer pool can be the wider research community (perhaps including regions under-represented among reviewers), statisticians or other professionals, or even patients as proposed at the Journal of Participatory Medicine (Shashok 2010).? (Ware 2011)",,1,1,0,1,1,0
"Fitzpatrick, Kathleen, and Katherine Rowe",2010,Keywords for Open Peer Review,Logos 21 (3): 133?41,10.1163/095796511X560024,Journal articles,Article,SSH,"""A core principle of open review is the provision that the texts under review and reviewers? comments will remain available."", ""In the context of peer review, an open process may involve named or anonymous participants. For the many reasons discussed in this essay, SQ concluded that participants in our open vetting should be named (see ?Translation effects?, ?Accountability? and ?Peer-to-peer reviewing?).""","As Shakespeare Quarterly?s open peer review experiment in partnership with Media-Commons Press ""In the spring of 2010, Shakespeare Quarterly (SQ) designed and mplemented a hybrid review process for its special issue 61:3 ?Shakespeare and New Media,? guest edited by Rowe.2 After researching different modes of digital publication and consulting the scholarship on peer review, the editors decided to test the opportunities and challenges offered by online open reviewing.3 For this experiment, the editors adapted SQ?s established procedures to include a public and named phase of vetting, open to any reviewer but actively inviting those with relevant expertise. Running from 10 March to 5 May 2010, the process drew a self-selected community of Shakespeareans and others with expertise in media history.""",1,1,0,1,0,0
"McCormack, Nancy",2009,"Peer Review and Legal Publishing: What Law Librarians Need to Know about Open, Single-Blind, and Double-Blind Reviewing","Law
 Library Journal 101, 1 (2009): 59?70",http://www.aallnet.org/mm/Publications/llj/LLJ-Archives/Vol-101/pub_llj_v101n01/2009-03.pdf,Journal articles,Article,SSH,""" Open peer review, as the name suggests, does not attempt to mask the identity of authors or reviewers. """,,1,0,0,0,0,0
"Peters, Douglas P., and Stephen J. Ceci",1982,"Peer-Review Practices of Psychological Journals: The Fate of Published Articles, Submitted Again",Behavioral and Brain Sciences 5 (2): 187?195,10.1017/S0140525X00011183,Journal articles,Article,STEM,"(Peters and Ceci 1982a, 194) define ?open review? as being synonymous with Harnad?s ?open commentary?: ""A further extension of author involvement and a move toward more openness and accountability in the review process can be seen in the recent suggestions for (and implementation of) an ""open peer commentary"" or ""open review"" system (Harnad 1979) in this journal (and its model, Current Anthropology). The basic idea is to complement the conventional closed peer-review system by giving the authors of accepted (refereed) articles the opportunity to respond openly to criticism. With the article, commentaries (from first-round referees and others), and the author's formal response published together in their entirety, readers of the journal can have a chance to examine and appraise this process of ""creative disagreement"" and form their own opinions as to the merit of an individual's work.""",,1,1,1,1,0,0
"Armstrong, J. Scott",1982,Barriers to Scientific Contributions: The Author?s Formula,"Behavioral and Brain Sciences 5, no. 2 (June 1982): 197?199",,Journal articles,Article,STEM,"""an open reviewing system would be preferable. It would be more equitable and more efficient. Knowing that they would have to defend their views before their peers should provide referees with the motivation to do a good job. Also, as a side benefit, referees would be recognized for the work they had done (at least for those papers that were published). Open peer review would also improve communication. Referees and authors could discuss difficult issues to find ways to improve a paper, rather than dismissing it. Frequently, the review itself provides useful information. Should not these contributions be shared? Interested readers should have access to the reviews of the published papers. For important issues, referees could publish their review along with the paper.""",,1,1,1,1,0,0
"Hames, Irene",2007,Peer Review and Manuscript Management in Scientific Journals: Guidelines for Good Practice,John Wiley & Sons,,Journal articles,Book,Interdisciplinary,"""In open peer review, the authors know the identity of the reviewers.""",,1,0,0,0,0,0
"Regazzi, John J.",2015,Scholarly Communications: A History from Content as King to Content as Kingmaker,Rowman & Littlefield,,Journal articles,Book,Interdisciplinary,"Another concept gaining popularity is open peer review. In the open peer-review process, reviewer names are included on the review reports. The author knows the names of the peer reviewers. If the journal article or paper is published, the peer-review reports with names are also published online, along with the prepublication history.... In another form of the open peer review, scientists can sign up with a journal to serve as a reviewer for articles yet to be published or volunteer to peer review articles needing assessment. The articles and reviews are posted online.",,1,1,0,1,0,0
"Morrison, Heather",2009,Scholarly Communication for Librarians,Elsevier,,Journal articles,Book,Interdisciplinary,"""Open peer review has two possible meanings: either everyone knows who both reviewer and author are, or review is open to anyone (sometimes both these conditions may apply).""",,1,0,0,1,0,0
